{
  "t": "config",
  "video": {
    "codec": "avc1.42E01F",
    "w": 480,
    "h": 640,
    "fps": 15,
    "bitrate_kbps": 400,
    "annexb": true,
    "container": null,
    "mirrored": false,
    "rotation": 0,
    "gop_ms": 2000
  },
  "audio": {
    "codec": "opus",
    "sample_rate": 16000,
    "channels": 1,
    "bitrate_kbps": 24,
    "frame_ms": 20,
    "muxed_in_video": false,
    "echo_cancellation": false,
    "noise_suppression": false,
    "auto_gain": false
  },
  "rung": 2,
  "clock_source": "shared"
}
