{
  "t": "config",
  "video": {
    "codec": "vp8",
    "w": 288,
    "h": 384,
    "fps": 10,
    "bitrate_kbps": 150,
    "annexb": false,
    "container": null,
    "mirrored": false,
    "rotation": 0,
    "gop_ms": 2000
  },
  "audio": {
    "codec": "opus",
    "sample_rate": 16000,
    "channels": 1,
    "bitrate_kbps": 12,
    "frame_ms": 20,
    "muxed_in_video": false,
    "echo_cancellation": false,
    "noise_suppression": false,
    "auto_gain": false
  },
  "rung": 4,
  "clock_source": "shared"
}
